thread_number,TITLE
thread 1, bachelorette  recap   spoiler  upsets andi   goes home
thread 1,the bachelorette  eric hill s last episode
thread 1, the bachelorette  recap  andi takes the guys to connecticut
thread 1,eric hill makes last appearance on the bachelorette as he leaves andi     
thread 1,the bachelorette review  don t quit your day job
thread 1, the bachelorette  2014 spoilers  will andi dorfman give final rose to josh     
thread 1,the bachelorette  watch season 10 episode 4 online
thread 1, the bachelorette  episode 3 recap it s  not  so hard to say goodbye
thread 1, the bachelorette  recap  eric hill s dramatic exit and andi dorfman s secret     
thread 1,the bachelorette recap  second hand awkwardness
thread 1,new bachelorette 2014 episode 5 spoiler promo clip released
thread 1, the bachelorette  recap 2014  so  dylan petitt shall be played by dean     
thread 1,who wins the bachelorette 2014  who does andi dorfman pick  spoilers  
thread 1,the worst of bachelorette recap
thread 1, bachelorette  andi plays ball  eric hill exits
thread 1, the bachelorette  contestant tasos hernandez reportedly gay  eric hill s exit     
thread 1,the bachelorette s andi  boyz ii men performance was the  date of a lifetime 
thread 1, the bachelorette  episode 4   i came on this to meet a person  not a tv actress  
thread 1,chris harrison blogs  the bachelorette  episode 4
thread 1, the bachelorette  spoilers  will abc air andi dorfman learning about eric hill s     
thread 1, the bachelorette  recap  one guy gets sent home early
thread 1, the bachelorette  recap  eric hill s farewell is both bitter and sweet
thread 1, the bachelorette  week three recap  andi plays basketball with the boys
thread 1,bachelorette 2014 episode 4  who went home tonight in connecticut 
thread 1, the bachelorette  recap  hoop dreams and crushed hopes
thread 1,bachelorette 2014  what happened between eric hill and andi dorfman on     
thread 1,this is the bachelorette s scientific formula to make couples fall in love
thread 1,bachelorette 2014 episode 4 recap  eric calls out andi s poker face
thread 1, the bachelorette  season 10 episode 4 recap  trinity coach scores points with     
thread 1,bachelorette 2014 spoilers  who gets eliminated in france in episode 5 
thread 1,bachelorette 2014 episode 4  twitter turns on andi dorfman after eric hill exit
thread 2,the bachelorette 2014 episode 4 twitter recap  too soon  marcus 
